{
  "schema": 1,
  "module": "hippocampus-memory",
  "version": "3.9.0",
  "capabilities": [
    "episodic_encoding",
    "episodic_retrieval",
    "consolidation",
    "replay_consolidation",
    "decay",
    "reflection"
  ],
  "inputs": [
    {
      "name": "workspace_events",
      "type": "event",
      "source": "workspace/events"
    },
    {
      "name": "core_memory",
      "type": "state_file",
      "source": "memory/hippocampus-core.json",
      "required": false
    }
  ],
  "outputs": [
    {
      "name": "core_sync",
      "type": "state_write",
      "target": "memory/hippocampus-core.json"
    },
    {
      "name": "event_log",
      "type": "log_entry",
      "target": "memory/hippocampus-events.jsonl"
    },
    {
      "name": "semantic_state",
      "type": "state_write",
      "target": "memory/semantic-state.json"
    },
    {
      "name": "self_reflection",
      "type": "state_write",
      "target": "memory/self/*.md"
    }
  ],
  "side_effects": [
    "writes_shared_state",
    "spawns_inference",
    "filesystem_write"
  ],
  "dependencies": [],
  "tests": [
    {
      "path": "tests/run_phase1_harness.sh",
      "kind": "regression"
    },
    {
      "path": "tests/run_phase7_harness.sh",
      "kind": "regression"
    },
    {
      "path": "tests/test_hippocampus_load_core.sh",
      "kind": "unit"
    },
    {
      "path": "tests/test_snapshot_tick.sh",
      "kind": "unit"
    },
    {
      "path": "tests/test_hippocampus_replay.sh",
      "kind": "unit"
    }
  ],
  "immutable": false
}
